{
  "schemaVersion": 1,
  "name": "navigaite-delivery-controller",
  "mode": "company-delivery",
  "scope": { "companies": ["// Navigaite"], "githubOwners": ["navigaite"] },
  "authority": {
    "read": ["paperclip_company", "github_metadata", "delivery_evidence", "ci_usage"],
    "write": ["paperclip_company_transitions", "github_preflight_checks", "github_pull_requests"],
    "deny": ["other_companies", "git_push", "git_merge", "github_release", "production_approval", "production_deploy", "secret_values"]
  },
  "runtime": { "deterministic": true, "maxImplementationConcurrency": 2, "credentialSource": "infisical-oidc" }
}
